"ITEMID","VISIBLENAME","DESC","VAL","SLOTID","WEAPONTYPE","AREA","CANSALE","CURRENTUPGRADENUM","DCSCSV","WAITTIME","SOUNDID","ATTACKCOUNT","SELECTTYPE","IFF","DEFAULTTARGETTEAM","SWITCHTEAM","SELFTARGET","TARGETING"
"A4480","魔射缶：阿多丘思考回路","封入された魔法を起動する。/使うとなくなる。/１人に詠唱すると、減っている正気度の3倍攻撃力が上がる。","7500",,,"72","TRUE","0","POW,M_ATK","4500","SD1032","1","ONE","FALSE","ENEMY","TRUE","TRUE","TRUE"
"A4481","魔射缶：いいね！","封入された魔法を起動する。/使うとなくなる。/１人の正気度を少量回復する。","7500",,,"72","TRUE","0","POW,M_ATK","4500","SD1032","1","ONE","FALSE","ENEMY","TRUE","TRUE","TRUE"
"A4482","魔射缶：超絶・百連撃","封入された魔法を起動する。/使うとなくなる。/術者が装備している武器の攻撃回数を１00にするが、武器と基礎の攻撃力が１になる。/中確率で武器が消滅する。フィールドでしか使えない。","7500",,,"0","TRUE","0","POW,M_ATK","4500","SD1032","1","ONE","FALSE","PARTY","FALSE","TRUE","FALSE"
"A4483","魔射缶：記憶操作","封入された魔法を起動する。/使うとなくなる。/１人の精神力と正気度にダメージ。","7500",,,"72","TRUE","0","POW,M_ATK","4500","SD1032","1","ONE","FALSE","ENEMY","TRUE","TRUE","TRUE"
"A4484","魔射缶：ガーニンの左手","封入された魔法を起動する。/使うとなくなる。/術者の装備している武器の攻撃力が１になるが、価値が１00倍になる。/フィールドでしか使えない。","7500",,,"0","TRUE","0","POW,M_ATK","4500","SD1032","1","ONE","FALSE","PARTY","FALSE","TRUE","FALSE"
"A4485","魔射缶：ガーニンの右手","封入された魔法を起動する。/使うとなくなる。/術者の装備している武器の攻撃力が１00増えるが、術者は正気度が１になる。/フィールドでしか使えない。","7500",,,"0","TRUE","0","POW,M_ATK","4500","SD1032","1","ONE","FALSE","PARTY","FALSE","TRUE","FALSE"
"A4486","魔射缶：エンチャント氷","封入された魔法を起動する。/使うとなくなる。/術者が装備している武器の攻撃属性を変化する。/元の攻撃属性は消える。","7500",,,"0","TRUE","0","POW,M_ATK","4500","SD1036","1","ONE","FALSE","PARTY","FALSE","TRUE","FALSE"
"A4487","魔射缶：エンチャント炎","封入された魔法を起動する。/使うとなくなる。/術者が装備している武器の攻撃属性を変化する。/元の攻撃属性は消える。","7500",,,"0","TRUE","0","POW,M_ATK","4500","SD1036","1","ONE","FALSE","PARTY","FALSE","TRUE","FALSE"
"A4488","魔射缶：エンチャント雷","封入された魔法を起動する。/使うとなくなる。/術者が装備している武器の攻撃属性を変化する。/元の攻撃属性は消える。","7500",,,"0","TRUE","0","POW,M_ATK","4500","SD1036","1","ONE","FALSE","PARTY","FALSE","TRUE","FALSE"
"A4489","魔射缶：エンチャント空気","封入された魔法を起動する。/使うとなくなる。/術者が装備している武器の攻撃属性を変化する。/元の攻撃属性は消える。","7500",,,"0","TRUE","0","POW,M_ATK","4500","SD1036","1","ONE","FALSE","PARTY","FALSE","TRUE","FALSE"
"A4490","魔射缶：エンチャント神秘","封入された魔法を起動する。/使うとなくなる。/術者が装備している武器の攻撃属性を変化する。/元の攻撃属性は消える。","7500",,,"0","TRUE","0","POW,M_ATK","4500","SD1036","1","ONE","FALSE","PARTY","FALSE","TRUE","FALSE"
"A4491","魔射缶：エンチャント錬金","封入された魔法を起動する。/使うとなくなる。/術者が装備している武器の攻撃属性を変化する。/元の攻撃属性は消える。","7500",,,"0","TRUE","0","POW,M_ATK","4500","SD1036","1","ONE","FALSE","PARTY","FALSE","TRUE","FALSE"
"A4492","びあ","最も普及している酒で、麦などから作られている。/おいしいが、毎日飲むとすごく太る。/精神力と体力を少量回復する。","300",,,,"TRUE","0",,"60","SD1013","1","ONE","FALSE","PARTY","TRUE","TRUE","TRUE"
"A4493","ブルーティー","よく飲まれているお茶だ。なぜか青い。/体力と精神力を少量回復する。","150",,,,"TRUE","0",,"60","SD1013","1","ONE","FALSE","PARTY","TRUE","TRUE","TRUE"
"A4494","魔射缶：エンチャント光","封入された魔法を起動する。/使うとなくなる。/術者が装備している武器の攻撃属性を変化する。/元の攻撃属性は消える。","7500",,,"0","TRUE","0","POW,M_ATK","4500","SD1036","1","ONE","FALSE","PARTY","FALSE","TRUE","FALSE"
"A4495","魔射缶：エンチャント闇","封入された魔法を起動する。/使うとなくなる。/術者が装備している武器の攻撃属性を変化する。/元の攻撃属性は消える。","7500",,,"0","TRUE","0","POW,M_ATK","4500","SD1036","1","ONE","FALSE","PARTY","FALSE","TRUE","FALSE"
"A4496","魔射缶：エンチャント精神","封入された魔法を起動する。/使うとなくなる。/術者が装備している武器の攻撃属性を変化する。/元の攻撃属性は消える。","7500",,,"0","TRUE","0","POW,M_ATK","4500","SD1036","1","ONE","FALSE","PARTY","FALSE","TRUE","FALSE"
"A4497","魔射缶：エンチャント水","封入された魔法を起動する。/使うとなくなる。/術者が装備している武器の攻撃属性を変化する。/元の攻撃属性は消える。","7500",,,"0","TRUE","0","POW,M_ATK","4500","SD1036","1","ONE","FALSE","PARTY","FALSE","TRUE","FALSE"
"A4498","魔射缶：五色破壊光線","封入された魔法を起動する。/使うとなくなる。/効果範囲全体に、水、炎、冷気、雷、空気属性でそれぞれダメージを与える。","7500",,,"600","TRUE","0","POW,M_ATK","4500","SD1031","1","IN_AREA","TRUE","ENEMY","TRUE","TRUE","TRUE"
"A4499","魔射缶：ブラックライト破壊光線","封入された魔法を起動する。/使うとなくなる。/効果範囲全体に闇属性ダメージ。","7500",,,"600","TRUE","0","POW,M_ATK","4500","SD1031","1","IN_AREA","TRUE","ENEMY","TRUE","TRUE","TRUE"
"A4500","魔射缶：ステロイド","封入された魔法を起動する。/使うとなくなる。/対象は筋力が増加するが、正気度を失う。/フィールドでしか使えない。","7500",,,"72","TRUE","0","POW,M_ATK","4500","SD1033","1","ONE","FALSE","PARTY","FALSE","TRUE","FALSE"
"A4501","魔射缶：偽りの肉体","封入された魔法を起動する。/使うとなくなる。/対象は筋力が増加するが、精神力を失う。/フィールドでしか使えない。","7500",,,"72","TRUE","0","POW,M_ATK","4500","SD1033","1","ONE","FALSE","PARTY","FALSE","TRUE","FALSE"
"A4502","魔射缶：麺料理大発見","封入された魔法を起動する。/使うとなくなる。/ランダムな対象１人が混乱する。この魔法は確実に成功する。","7500",,,"9999","TRUE","0","POW,M_ATK","4500","SD1032","1","IN_AREA","FALSE","ENEMY","FALSE","TRUE","FALSE"
"A4503","魔射缶：タイムリープ：過去","封入された魔法を起動する。/使うとなくなる。/上位者に介入し、メインクエストの進行状況を１段階戻す。/これにより世界が崩壊する可能性がある。","7500",,,"0","TRUE","0","POW,M_ATK","4500","SD1020","1","ONE","FALSE","PARTY","FALSE","TRUE","FALSE"
"A4504","魔射缶：タイムリープ：未来","封入された魔法を起動する。/使うとなくなる。/上位者に介入し、メインクエストの進行状況を１段階進める。/これにより世界が崩壊する可能性がある。","7500",,,"0","TRUE","0","POW,M_ATK","4500","SD1020","1","ONE","FALSE","PARTY","FALSE","TRUE","FALSE"
"A4505","魔射缶：安全地帯","封入された魔法を起動する。/使うとなくなる。/魔法の効果範囲内にいない全員は即死する。範囲内にいるものは回復する。/この魔法は確実に成功する。","7500",,,"240","TRUE","0","POW,M_ATK","4500","SD1032","1","IN_AREA","FALSE","PARTY","FALSE","TRUE","FALSE"
"A4506","魔射缶：先勝ち","封入された魔法を起動する。/使うとなくなる。/後列で戦闘を開始したメンバーは即死する。/前列で戦闘を開始したメンバーの攻撃、防御、魔法攻撃、魔法防御が上昇する。/この魔法は確実に成功する。","7500",,,"9999","TRUE","0","POW,M_ATK","4500","SD1032","1","IN_AREA","FALSE","PARTY","FALSE","TRUE","FALSE"
"A4507","魔射缶：後勝ち","封入された魔法を起動する。/使うとなくなる。/前列で戦闘を開始したメンバーは即死する。/後列で戦闘を開始したメンバーの攻撃、防御、魔法攻撃、魔法防御が上昇する。/この魔法は確実に成功する。","7500",,,"9999","TRUE","0","POW,M_ATK","4500","SD1032","1","IN_AREA","FALSE","PARTY","FALSE","TRUE","FALSE"
"A4508","魔射缶：タンク","封入された魔法を起動する。/使うとなくなる。/前列で戦闘を開始したメンバーの防御力が上昇する。","7500",,,"9999","TRUE","0","POW,M_ATK","4500","SD1032","1","IN_AREA","FALSE","PARTY","FALSE","TRUE","FALSE"
"A4509","魔射缶：ヘイスト","封入された魔法を起動する。/使うとなくなる。/１人の素早さを上昇する。","7500",,,"180","TRUE","0","POW,M_ATK","4500","SD1020","1","ONE","FALSE","PARTY","TRUE","TRUE","TRUE"
"A4510","魔射缶：追加の腕","封入された魔法を起動する。/使うとなくなる。/１人の器用さと筋力を上昇する。","7500",,,"180","TRUE","0","POW,M_ATK","4500","SD1032","1","ONE","FALSE","PARTY","TRUE","TRUE","TRUE"
"A4511","魔射缶：オカトーの独壇場","封入された魔法を起動する。/使うとなくなる。/詠唱完了したとき、術者は直ちに追加で3回行動できる。/魔力や正気度が足りれば、この3回でさらに詠唱することもできる。","7500",,,"0","TRUE","0","POW,M_ATK","4500","SD1020","1","ONE","FALSE","PARTY","FALSE","TRUE","FALSE"
"A4512","魔射缶：赤影","封入された魔法を起動する。/使うとなくなる。/詠唱完了したとき、そのターンの最後に、対象者が追加で2回行動できる。/魔力や正気度が足りれば、この2回でさらに詠唱することもできる。","7500",,,"180","TRUE","0","POW,M_ATK","4500","SD1032","1","ONE","FALSE","PARTY","TRUE","TRUE","TRUE"
"A4513","魔射缶：通行止め","封入された魔法を起動する。/使うとなくなる。/このターンのまだ行動していないランダムな対象１人は行動がスキップされる。","7500",,,"9999","TRUE","0","POW,M_ATK","4500","SD1032","1","ONE","FALSE","PARTY","FALSE","TRUE","FALSE"
"A4514","魔射缶：分身の術","封入された魔法を起動する。/使うとなくなる。/このターンのまだ行動していないランダムな対象１人はこのターンの最後に追加で１回行動できる。","7500",,,"9999","TRUE","0","POW,M_ATK","4500","SD1032","1","ONE","FALSE","PARTY","FALSE","TRUE","FALSE"
"A4515","魔射缶：速足","封入された魔法を起動する。/使うとなくなる。/このターンの最後に、対象者が追加で１回行動できる。/魔力や正気度が足りれば、この１回でさらに詠唱することもできる。","7500",,,"180","TRUE","0","POW,M_ATK","4500","SD1032","1","ONE","FALSE","PARTY","TRUE","TRUE","TRUE"
"A4516","魔射缶：トリックルーム","封入された魔法を起動する。/使うとなくなる。/このターンの行動順を逆転させる。まだ行動していないキャラのみが対象。/すなわち素早さの低い順で行動ができるようになる。","7500",,,"9999","TRUE","0","POW,M_ATK","4500","SD1032","1","ONE","FALSE","PARTY","FALSE","TRUE","FALSE"
"A4517","魔射缶：足軽","封入された魔法を起動する。/使うとなくなる。/対象者の行動力を１上昇する。フィールドでしか使えない。","7500",,,"0","TRUE","0","POW,M_ATK","4500","SD1032","1","ONE","FALSE","PARTY","FALSE","TRUE","FALSE"
"A4518","魔射缶：魔術封印","封入された魔法を起動する。/使うとなくなる。/効果範囲内で魔術を詠唱中のものは、詠唱が中断される。","7500",,,"440","TRUE","0","POW,M_ATK","4500","SD1032","1","IN_AREA","FALSE","ENEMY","FALSE","TRUE","FALSE"
"A4519","魔射缶：伝説の究極魔法","封入された魔法を起動する。/使うとなくなる。/詠唱に99ターンかかる。詠唱できたものがいないため、実際の効果は謎に包まれている。","7500",,,"9999","TRUE","0","POW,M_ATK","4500","SD1040","1","IN_AREA","FALSE","ENEMY","FALSE","TRUE","FALSE"
"A4520","魔射缶：高速詠唱破壊光線","封入された魔法を起動する。/使うとなくなる。/詠唱に成功すると、そのターンの最後に破壊光線（弱）を3回発動する。/発動時のコストは術者が毎回支払う。","7500",,,"300","TRUE","0","POW,M_ATK","4500","SD1012","1","IN_AREA","TRUE","ENEMY","TRUE","TRUE","TRUE"
"A4521","魔射缶：超高速詠唱破壊光線","封入された魔法を起動する。/使うとなくなる。/詠唱に成功すると、そのターンの最後に破壊光線（弱）を6回発動する。/発動時のコストは術者が毎回支払う。","7500",,,"300","TRUE","0","POW,M_ATK","4500","SD1012","1","IN_AREA","TRUE","ENEMY","TRUE","TRUE","TRUE"
"A4522","魔射缶：偽りの記憶","封入された魔法を起動する。/使うとなくなる。/対象者は現在の経験値が増えるが、正気度を失う。フィールドでしか使えない。","7500",,,"0","TRUE","0","POW,M_ATK","4500","SD1033","1","ONE","TRUE","PARTY","FALSE","TRUE","FALSE"
"A4523","魔射缶：魔力注入","封入された魔法を起動する。/使うとなくなる。/対象者は正気度が0になって発狂するが魔法を使えるようになる。/詠唱に非常に大きなコストがかかる。フィールドでしか使えない。","7500",,,"0","TRUE","0","POW,M_ATK","4500","SD1032","1","ONE","TRUE","PARTY","FALSE","TRUE","FALSE"
"A4524","魔射缶：ハレーション","封入された魔法を起動する。/使うとなくなる。/効果範囲内の全員の体力を１にする。この魔法は確実に成功する。","7500",,,"480","TRUE","0","POW,M_ATK","4500","SD1032","1","IN_AREA","FALSE","ENEMY","FALSE","TRUE","FALSE"
"A4525","魔射缶：ヘビーボンバー","封入された魔法を起動する。/使うとなくなる。/１人に衝撃属性のダメージ。術者がアイテムと魔術書をたくさん持っているほどダメージが上がる。一部のアイテムを持っている場合は威力がさらに高くなる。","7500",,,"72","TRUE","0","POW,M_ATK","4500","SD1032","1","ONE","FALSE","ENEMY","TRUE","TRUE","TRUE"
"A4526","魔射缶：輝きの海","封入された魔法を起動する。/使うとなくなる。/全員が毒状態になる。","7500",,,"480","TRUE","0","POW,M_ATK","4500","SD1035","1","IN_AREA","FALSE","ENEMY","FALSE","TRUE","FALSE"
"A4527","魔射缶：戦闘の準備","封入された魔法を起動する。/使うとなくなる。/後列で戦闘を開始したメンバーは攻撃力、防御力、素早さが上昇する。","7500",,,"9999","TRUE","0","POW,M_ATK","4500","SD1032","1","IN_AREA","TRUE","PARTY","FALSE","TRUE","FALSE"
"A4528","魔射缶：二撃必殺","封入された魔法を起動する。/使うとなくなる。/詠唱に成功すると、術者は直ちに2回行動できる。/魔力や正気度が足りれば、この2回でさらに詠唱することもできる。","7500",,,"0","TRUE","0","POW,M_ATK","4500","SD1032","1","ONE","FALSE","PARTY","FALSE","TRUE","FALSE"
"A4529","魔射缶：磁石","封入された魔法を起動する。/使うとなくなる。/詠唱に成功すると、すべての対象者が魔法の効果範囲内に転送される。対象者は正気度を少量失う。","7500",,,"420","TRUE","0","POW,M_ATK","4500","SD1032","1","IN_AREA","FALSE","ENEMY","FALSE","TRUE","FALSE"
"A4530","魔射缶：ぬるぽ","封入された魔法を起動する。/使うとなくなる。/近くにいるに衝撃属性の弱ダメージ。ただし低確率で世界が崩壊する。","7500",,,"48","TRUE","0","POW,M_ATK","4500","SD1022","1","ONE","FALSE","ENEMY","TRUE","TRUE","TRUE"
"A4531","魔射缶：錬金爆発","封入された魔法を起動する。/使うとなくなる。/範囲内の黄金化状態にあるキャラは黄金化が解除され、ダメージを受ける。","7500",,,"350","TRUE","0","POW,M_ATK","4500","SD1035","1","IN_AREA","FALSE","ENEMY","FALSE","TRUE","TRUE"
"A4532","魔射缶：変異","封入された魔法を起動する。/使うとなくなる。/術者の防御力と魔法防御力が大きく上昇する。術者は高確率で黄金化する。","7500",,,"0","TRUE","0","POW,M_ATK","4500","SD1036","1","ONE","FALSE","ENEMY","FALSE","TRUE","FALSE"
"A4533","魔射缶：押し出し","封入された魔法を起動する。/使うとなくなる。/魔法の効果範囲内の敵対者は強制的かつ直ちに後退する。","7500",,,"240","TRUE","0","POW,M_ATK","4500","SD1022","1","IN_AREA","FALSE","ENEMY","FALSE","TRUE","FALSE"
"A4534","魔射缶：PUSH・PUSH・PUSH！","封入された魔法を起動する。/使うとなくなる。/１人が強制的かつ直ちに後退する。","7500",,,"72","TRUE","0","POW,M_ATK","4500","SD1022","1","ONE","FALSE","ENEMY","TRUE","TRUE","TRUE"
"A4535","魔射缶：裏切り","封入された魔法を起動する。/使うとなくなる。/１人にダメージ。術者は攻撃力と魔法攻撃力が上昇する。","7500",,,"72","TRUE","0","POW,M_ATK","4500","SD1019","1","ONE","FALSE","PARTY","TRUE","TRUE","TRUE"
"A4536","魔射缶：そば団子召喚","封入された魔法を起動する。/使うとなくなる。/世界のどこかにあるアイテムを転送する。/術者のアイテム欄に空きがある場合、術者はそば団子を手に入れる。","7500",,,"0","TRUE","0","POW,M_ATK","4500","SD1040","1","ONE","TRUE","PARTY","FALSE","TRUE","FALSE"
"A4537","魔射缶：お魚召喚","封入された魔法を起動する。/使うとなくなる。/世界のどこかにあるアイテムを転送する。/術者のアイテム欄に空きがある場合、術者はランダムな魚を手に入れる。","7500",,,"0","TRUE","0","POW,M_ATK","4500","SD1040","1","ONE","TRUE","PARTY","FALSE","TRUE","FALSE"
"A4538","魔射缶：出前そば注文","封入された魔法を起動する。/使うとなくなる。/世界のどこかにあるアイテムを転送する。/術者のアイテム欄に空きがある場合、術者は出前もりそばを手に入れる。","7500",,,"0","TRUE","0","POW,M_ATK","4500","SD1040","1","ONE","TRUE","PARTY","FALSE","TRUE","FALSE"
"A4539","魔射缶：ガチャ","封入された魔法を起動する。/使うとなくなる。/世界のどこかにあるアイテムを転送する。/術者のアイテム欄に空きがある場合、術者はランダムなアイテムを手に入れる。ただし重要なアイテムは含まれない。","7500",,,"0","TRUE","0","POW,M_ATK","4500","SD1040","1","ONE","TRUE","PARTY","FALSE","TRUE","FALSE"
"A4540","魔射缶：アポクリファ","封入された魔法を起動する。/使うとなくなる。/世界のどこかにある魔術書を転送する。/術者の魔術書欄に空きがある場合、術者はランダムな魔術書を手に入れる。","7500",,,"0","TRUE","0","POW,M_ATK","4500","SD1040","1","ONE","TRUE","PARTY","FALSE","TRUE","FALSE"
"A4541","魔射缶：赤の絨毯","封入された魔法を起動する。/使うとなくなる。/次の出現までの歩数を長くする。/フィールドでしか使えない。敵がいないマップでは何も起こらない。","7500",,,"0","TRUE","0","POW,M_ATK","4500","SD1040","1","ONE","TRUE","PARTY","FALSE","TRUE","FALSE"
"A4542","魔射缶：白の絨毯","封入された魔法を起動する。/使うとなくなる。/次の出現までの歩数を短くする。/フィールドでしか使えない。敵がいないマップでは何も起こらない。","7500",,,"0","TRUE","0","POW,M_ATK","4500","SD1040","1","ONE","TRUE","PARTY","FALSE","TRUE","FALSE"
"A4543","魔射缶：の召喚","封入された魔法を起動する。/使うとなくなる。/直ちに戦闘が開始される。フィールドでしか使えない。敵がいないマップでは何も起こらない。","7500",,,,"TRUE","0",,,,,,,,,,
"A4544","魔射缶：セキュリティ違反","封入された魔法を起動する。/使うとなくなる。/上位者の環境を表示する。","7500",,,"0","TRUE","0","POW,M_ATK","4500","SD1032","1","ONE","TRUE","PARTY","FALSE","TRUE","FALSE"
"A4545","魔射缶：危険な悪戯","封入された魔法を起動する。/使うとなくなる。/上位者のデスクトップに１00個の無意味なファイルを生成する。","7500",,,"0","TRUE","0","POW,M_ATK","4500","SD1032","1","ONE","TRUE","PARTY","FALSE","TRUE","FALSE"
"A4546","魔射缶：青い鳥","封入された魔法を起動する。/使うとなくなる。/上位者に介入し、この世界を作ったもの青い鳥を表示する。","7500",,,"0","TRUE","0","POW,M_ATK","4500","SD1032","1","ONE","TRUE","PARTY","FALSE","TRUE","FALSE"
"A4547","魔射缶：究極魔法：死滅","封入された魔法を起動する。/使うとなくなる。/詠唱完了したターンの最後に、魔術「絶滅の光」を99回発動する。","7500",,,"9999","TRUE","0","POW,M_ATK","4500","SD1020","1","IN_AREA","FALSE","ENEMY","FALSE","TRUE","FALSE"
"A4548","魔射缶：精神の退避","封入された魔法を起動する。/使うとなくなる。/１人の消滅耐性が向上する。","7500",,,"180","TRUE","0","POW,M_ATK","4500","SD1033","1","ONE","FALSE","PARTY","TRUE","TRUE","TRUE"
"A4549","魔射缶：プルプルンテ","封入された魔法を起動する。/使うとなくなる。/詠唱完了したターンの最後に、追加でランダムな魔法の詠唱が完了する。/この詠唱コストは術者が支払う。","7500",,,"0","TRUE","0","POW,M_ATK","4500","SD1032","1","ONE","FALSE","PARTY","FALSE","TRUE","FALSE"
"A4550","魔射缶：障害物の除去","封入された魔法を起動する。/使うとなくなる。/戦闘フィールド内にある障害物をすべて破壊する。障害物がない時は何も起こらない。","7500",,,"9999","TRUE","0","POW,M_ATK","4500","SD1035","1","IN_AREA","FALSE","ENEMY","FALSE","TRUE","FALSE"
"A4551","魔射缶：破壊","封入された魔法を起動する。/使うとなくなる。/戦闘フィールド内にある効果範囲内の障害物をすべて破壊する。/障害物がない時は何も起こらない。","7500",,,"9999","TRUE","0","POW,M_ATK","4500","SD1035","1","IN_AREA","FALSE","ENEMY","FALSE","TRUE","FALSE"
"A4552","魔射缶：阻止","封入された魔法を起動する。/使うとなくなる。/詠唱完了したとき、そのターンでまだ行動していないキャラはそのターンの行動が一切できなくなる。","7500",,,"9999","TRUE","0","POW,M_ATK","4500","SD1033","1","IN_AREA","FALSE","ENEMY","FALSE","TRUE","FALSE"
"A4553","魔射缶：アベレージ体力","封入された魔法を起動する。/使うとなくなる。/術者と１人の体力を合計し、半分ずつに分配する。","7500",,,"72","TRUE","0","POW,M_ATK","4500","SD1014","1","ONE","FALSE","PARTY","TRUE","TRUE","TRUE"
"A4554","魔射缶：アベレージ魔力","封入された魔法を起動する。/使うとなくなる。/術者と１人の魔力を合計し、半分ずつに分配する。","7500",,,"72","TRUE","0","POW,M_ATK","4500","SD1014","1","ONE","FALSE","PARTY","TRUE","TRUE","TRUE"
"A4555","魔射缶：春一番","封入された魔法を起動する。/使うとなくなる。/効果範囲内の全対象を低確率で木化させる。","7500",,,"480","TRUE","0","POW,M_ATK","4500","SD1038","1","IN_AREA","FALSE","ENEMY","FALSE","TRUE","FALSE"
"A4556","魔射缶：赤目村","封入された魔法を起動する。/使うとなくなる。/効果範囲内の木化している全対象はダメージを受ける。/精神力と正気度にもダメージを与える。","7500",,,"320","TRUE","0","POW,M_ATK","4500","SD1032","1","IN_AREA","FALSE","ENEMY","FALSE","TRUE","FALSE"
"A4557","魔射缶：栄養吸収","封入された魔法を起動する。/使うとなくなる。/術者は体力と魔力を回復するが、低確率で木化する。/すでに木化している場合は効果が高まる。","7500",,,"0","TRUE","0","POW,M_ATK","4500","SD1032","1","ONE","FALSE","PARTY","FALSE","TRUE","FALSE"
"A4558","魔射缶：腐葉土","封入された魔法を起動する。/使うとなくなる。/効果範囲全体は体力と魔力を回復するが、/低確率で木化する。すでに木化している場合は効果が高まる。","7500",,,"360","TRUE","0","POW,M_ATK","4500","SD1032","1","ONE","FALSE","ENEMY","FALSE","TRUE","FALSE"
"A4559","魔射缶：緑の牛","封入された魔法を起動する。/使うとなくなる。/効果範囲内の木化している全対象は体力を回復する。","7500",,,"240","TRUE","0","POW,M_ATK","4500","SD1032","1","ONE","FALSE","ENEMY","FALSE","TRUE","FALSE"
