"ITEMID","VISIBLENAME","DESC","VAL","SLOTID","WEAPONTYPE","AREA","CANSALE","CURRENTUPGRADENUM","DCSCSV","WAITTIME","SOUNDID","ATTACKCOUNT","SELECTTYPE","IFF","DEFAULTTARGETTEAM","SWITCHTEAM","SELFTARGET","TARGETING"
"A4292","魔射缶：効果範囲全体リジェネ弱","封入された魔法を起動する。/使うとなくなる。/効果範囲全体にリジェネを付与する。","7500",,,"240","TRUE","0","POW,M_ATK","4500","SD1014","1","IN_AREA","FALSE","PARTY","TRUE","TRUE","TRUE"
"A4293","魔射缶：木化治療","封入された魔法を起動する。/使うとなくなる。/１人の木化を回復する。","7500",,,"72","TRUE","0","POW,M_ATK","4500","SD1014","1","ONE","FALSE","PARTY","TRUE","TRUE","TRUE"
"A4294","魔射缶：狂乱治療","封入された魔法を起動する。/使うとなくなる。/１人の混乱、狂乱、発狂を回復するが、術者の正気度と精神力が減る。","7500",,,"72","TRUE","0","POW,M_ATK","4500","SD1014","1","ONE","FALSE","PARTY","TRUE","TRUE","TRUE"
"A4295","魔射缶：混乱治療","封入された魔法を起動する。/使うとなくなる。/１人の混乱を回復する。","7500",,,"72","TRUE","0","POW,M_ATK","4500","SD1014","1","ONE","FALSE","PARTY","TRUE","TRUE","TRUE"
"A4296","魔射缶：昏睡","封入された魔法を起動する。/使うとなくなる。/１人を睡眠状態にする。","7500",,,"128","TRUE","0","POW,M_ATK","4500","SD1033","1","ONE","FALSE","PARTY","TRUE","TRUE","TRUE"
"A4297","魔射缶：狂乱の王子","封入された魔法を起動する。/使うとなくなる。/効果範囲全体を混乱状態にする。","7500",,,"300","TRUE","0","POW,M_ATK","4500","SD1033","1","IN_AREA","FALSE","ENEMY","TRUE","TRUE","TRUE"
"A4298","魔射缶：精神破壊","封入された魔法を起動する。/使うとなくなる。/効果範囲全体の精神力を低下させる。","7500",,,"300","TRUE","0","POW,M_ATK","4500","SD1033","1","IN_AREA","FALSE","ENEMY","TRUE","TRUE","TRUE"
"A4299","魔射缶：精神摩耗","封入された魔法を起動する。/使うとなくなる。/１人の精神力を低下させる。","7500",,,"150","TRUE","0","POW,M_ATK","4500","SD1014","1","ONE","FALSE","ENEMY","TRUE","TRUE","TRUE"
"A4300","魔射缶：肉体からの解放","封入された魔法を起動する。/使うとなくなる。/１人を低確率で消滅状態にする。","7500",,,"150","TRUE","0","POW,M_ATK","4500","SD1032","1","ONE","FALSE","ENEMY","TRUE","TRUE","TRUE"
"A4301","魔射缶：蘇生","封入された魔法を起動する。/使うとなくなる。/１人の死亡を回復する。復活した仲間は正気度が減る。","7500",,,"72","TRUE","0","POW,M_ATK","4500","SD1014","1","ONE","FALSE","PARTY","TRUE","TRUE","TRUE"
"A4302","魔射缶：消滅治療","封入された魔法を起動する。/使うとなくなる。/１人の消滅を回復する。復活した仲間は正気度が減る。","7500",,,"72","TRUE","0","POW,M_ATK","4500","SD1014","1","ONE","FALSE","PARTY","TRUE","TRUE","TRUE"
"A4303","魔射缶：単体リジェネ強","封入された魔法を起動する。/使うとなくなる。/１人にリジェネを付与する。","7500",,,"72","TRUE","0","POW,M_ATK","4500","SD1014","1","ONE","FALSE","PARTY","TRUE","TRUE","TRUE"
"A4304","魔射缶：効果範囲全体リジェネ強","封入された魔法を起動する。/使うとなくなる。/効果範囲全体にリジェネを付与する。","7500",,,"300","TRUE","0","POW,M_ATK","4500","SD1014","1","IN_AREA","FALSE","PARTY","TRUE","TRUE","TRUE"
"A4305","魔射缶：狂乱治療","封入された魔法を起動する。/使うとなくなる。/１人の狂乱を回復する。","7500",,,"72","TRUE","0","POW,M_ATK","4500","SD1014","1","ONE","FALSE","PARTY","TRUE","TRUE","TRUE"
"A4306","魔射缶：発狂治療","封入された魔法を起動する。/使うとなくなる。/１人の発狂を回復する。","7500",,,"72","TRUE","0","POW,M_ATK","4500","SD1014","1","ONE","FALSE","PARTY","TRUE","TRUE","TRUE"
"A4307","魔射缶：レギオ・フィルミナンテ","封入された魔法を起動する。/使うとなくなる。/神秘の雷で敵を3回攻撃する。","7500",,,"470","TRUE","0","POW,M_ATK","4500","SD1041","3","ONE","FALSE","ENEMY","TRUE","TRUE","TRUE"
"A4308","魔射缶：神の裁き","封入された魔法を起動する。/使うとなくなる。/神秘の雷で１人に強力な攻撃を行う。まれに消滅させる。","7500",,,"470","TRUE","0","POW,M_ATK","4500","SD1037","1","ONE","FALSE","ENEMY","TRUE","TRUE","TRUE"
"A4309","魔射缶：完全回復","封入された魔法を起動する。/使うとなくなる。/１人を完全に回復するが、正気度に少量ダメージ。","7500",,,"128","TRUE","0","POW,M_ATK","4500","SD1014","1","ONE","FALSE","PARTY","TRUE","TRUE","TRUE"
"A4310","魔射缶：錬金物質生成","封入された魔法を起動する。/使うとなくなる。/１人に錬金属性ダメージ。まれに黄金化状態にする。","7500",,,"98","TRUE","0","POW,M_ATK","4500","SD1035","1","ONE","FALSE","ENEMY","TRUE","TRUE","TRUE"
"A4311","魔射缶：錬金反応炉","封入された魔法を起動する。/使うとなくなる。/黄金化している１人を確実に即死させる。/黄金化していないには何もおこならない。","7500",,,"72","TRUE","0","POW,M_ATK","4500","SD1035","1","ONE","FALSE","ENEMY","TRUE","TRUE","TRUE"
"A4312","魔射缶：黄金化治療","封入された魔法を起動する。/使うとなくなる。/１人の黄金化を回復する。","7500",,,"72","TRUE","0","POW,M_ATK","4500","SD1014","1","ONE","FALSE","PARTY","TRUE","TRUE","TRUE"
"A4313","魔射缶：軟化","封入された魔法を起動する。/使うとなくなる。/１人の防御力を低下する。","7500",,,"150","TRUE","0","POW,M_ATK","4500","SD1035","1","ONE","FALSE","PARTY","TRUE","TRUE","TRUE"
"A4314","魔射缶：硬化","封入された魔法を起動する。/使うとなくなる。/１人の防御力を上昇する。","7500",,,"150","TRUE","0","POW,M_ATK","4500","SD1035","1","ONE","FALSE","PARTY","TRUE","TRUE","TRUE"
"A4315","魔射缶：状態異常回復１","封入された魔法を起動する。/使うとなくなる。/１人の毒、睡眠、気絶を治療する。","7500",,,"72","TRUE","0","POW,M_ATK","4500","SD1014","1","ONE","FALSE","PARTY","TRUE","TRUE","TRUE"
"A4316","魔射缶：黄金への誘い","封入された魔法を起動する。/使うとなくなる。/１人を低確率で黄金化する。","7500",,,"72","TRUE","0","POW,M_ATK","4500","SD1035","1","ONE","FALSE","PARTY","TRUE","TRUE","TRUE"
"A4317","魔射缶：状態異常回復２","封入された魔法を起動する。/使うとなくなる。/１人の黄金化、炎上、麻痺、凍結を治療する。","7500",,,"72","TRUE","0","POW,M_ATK","4500","SD1014","1","ONE","FALSE","PARTY","TRUE","TRUE","TRUE"
"A4318","魔射缶：筋力増強","封入された魔法を起動する。/使うとなくなる。/１人の筋力を上昇する。","7500",,,"72","TRUE","0","POW,M_ATK","4500","SD1033","1","ONE","FALSE","PARTY","TRUE","TRUE","TRUE"
"A4319","魔射缶：精神力増強","封入された魔法を起動する。/使うとなくなる。/１人の精神力を上昇する。","7500",,,"72","TRUE","0","POW,M_ATK","4500","SD1033","1","ONE","FALSE","PARTY","TRUE","TRUE","TRUE"
"A4320","魔射缶：錬金浸食","封入された魔法を起動する。/使うとなくなる。/効果範囲全体の防御力と魔法防御力を下げる。","7500",,,"180","TRUE","0","POW,M_ATK","4500","SD1035","1","IN_AREA","FALSE","ENEMY","TRUE","TRUE","TRUE"
"A4321","魔射缶：破壊光線（中）","封入された魔法を起動する。/使うとなくなる。/効果範囲全体にダメージを与え、低確率で消滅状態にする。","7500",,,"400","TRUE","0","POW,M_ATK","4500","SD1012","1","IN_AREA","TRUE","ENEMY","TRUE","TRUE","TRUE"
"A4322","魔射缶：正気度回復","封入された魔法を起動する。/使うとなくなる。/術者の魔力と精神力を消費して、対象の正気度を回復する。","7500",,,"78","TRUE","0","POW,M_ATK","4500","SD1014","1","ONE","FALSE","PARTY","TRUE","TRUE","TRUE"
"A4323","魔射缶：正気度損失","封入された魔法を起動する。/使うとなくなる。/術者の魔力と精神力を消費して、対象の正気度にダメージ。","7500",,,"78","TRUE","0","POW,M_ATK","4500","SD1032","1","ONE","FALSE","ENEMY","TRUE","TRUE","TRUE"
"A4324","魔射缶：正気度増強","封入された魔法を起動する。/使うとなくなる。/術者の魔力と精神力を消費して、対象の正気度を増強する。","7500",,,"78","TRUE","0","POW,M_ATK","4500","SD1014","1","ONE","FALSE","PARTY","TRUE","TRUE","TRUE"
"A4325","魔射缶：魔力回復","封入された魔法を起動する。/使うとなくなる。/術者の魔力と精神力を消費して、対象の魔力を回復する。","7500",,,"78","TRUE","0","POW,M_ATK","4500","SD1014","1","ONE","FALSE","PARTY","TRUE","TRUE","TRUE"
"A4326","魔射缶：魔力増強","封入された魔法を起動する。/使うとなくなる。/術者の魔力と精神力を消費して、対象の魔力を増強する。","7500",,,"78","TRUE","0","POW,M_ATK","4500","SD1032","1","ONE","FALSE","PARTY","TRUE","TRUE","TRUE"
"A4327","魔射缶：体力増強","封入された魔法を起動する。/使うとなくなる。/術者の魔力と精神力を消費して、対象の体力を増強する。","7500",,,"78","TRUE","0","POW,M_ATK","4500","SD1032","1","ONE","FALSE","PARTY","TRUE","TRUE","TRUE"
"A4328","魔射缶：破壊光線（弱）","封入された魔法を起動する。/使うとなくなる。/効果範囲全体にダメージを与え、低確率で消滅状態にする。","7500",,,"300","TRUE","0","POW,M_ATK","4500","SD1012","1","IN_AREA","TRUE","ENEMY","TRUE","TRUE","TRUE"
"A4329","魔射缶：破壊光線（強）","封入された魔法を起動する。/使うとなくなる。/効果範囲全体にダメージを与え、低確率で消滅状態にする。","7500",,,"500","TRUE","0","POW,M_ATK","4500","SD1031","1","IN_AREA","TRUE","ENEMY","TRUE","TRUE","TRUE"
"A4330","魔射缶：破壊光線（伝説）","封入された魔法を起動する。/使うとなくなる。/効果範囲全体に大ダメージを与え、高確率で消滅状態にする。","7500",,,"9999","TRUE","0","POW,M_ATK","4500","SD1031","1","IN_AREA","TRUE","ENEMY","TRUE","TRUE","TRUE"
"A4331","魔射缶：送風","封入された魔法を起動する。/使うとなくなる。/効果範囲全体の素早さを下げ、回避率を上げる。","7500",,,"450","TRUE","0","POW,M_ATK","4500","SD1038","1","IN_AREA","FALSE","ENEMY","FALSE","TRUE","FALSE"
"A4332","魔射缶：強風","封入された魔法を起動する。/使うとなくなる。/効果範囲全体の素早さを下げ、回避率を上げる。","7500",,,"450","TRUE","0","POW,M_ATK","4500","SD1038","1","IN_AREA","FALSE","ENEMY","FALSE","TRUE","FALSE"
"A4333","魔射缶：嵐","封入された魔法を起動する。/使うとなくなる。/効果範囲全体の素早さを下げ、回避率を上げる。/炎上を回復する。全員が湿潤状態になる。","7500",,,"450","TRUE","0","POW,M_ATK","4500","SD1038","1","IN_AREA","FALSE","ENEMY","FALSE","TRUE","FALSE"
"A4334","魔射缶：ストームコール","封入された魔法を起動する。/使うとなくなる。/効果範囲全体にランダムに雷属性で攻撃する。","7500",,,"600","TRUE","0","POW,M_ATK","4500","SD1037","8","IN_AREA","FALSE","ENEMY","FALSE","TRUE","FALSE"
"A4335","魔射缶：風切羽","封入された魔法を起動する。/使うとなくなる。/術者の素早さを上昇するが器用さが下がる。","7500",,,"0","TRUE","0","POW,M_ATK","4500","SD1039","1","ONE","TRUE","PARTY","FALSE","TRUE","FALSE"
"A4336","魔射缶：電撃","封入された魔法を起動する。/使うとなくなる。/１人に電気属性ダメージ。まれに麻痺させる。","7500",,,"88","TRUE","0","POW,M_ATK","4500","SD1012","1","ONE","FALSE","ENEMY","TRUE","TRUE","TRUE"
"A4337","魔射缶：向かい風","封入された魔法を起動する。/使うとなくなる。/敵の素早さを上昇し、味方の素早さを下げる。","7500",,,"500","TRUE","0","POW,M_ATK","4500","SD1038","1","IN_AREA","FALSE","ENEMY","FALSE","TRUE","FALSE"
"A4338","魔射缶：追い風","封入された魔法を起動する。/使うとなくなる。/味方の素早さを低下し、敵の素早さを上げる。","7500",,,"500","TRUE","0","POW,M_ATK","4500","SD1038","1","IN_AREA","FALSE","ENEMY","FALSE","TRUE","FALSE"
"A4339","魔射缶：凪風","封入された魔法を起動する。/使うとなくなる。/効果範囲全体の素早さの上下をリセットする。","7500",,,"500","TRUE","0","POW,M_ATK","4500","SD1038","1","IN_AREA","FALSE","ENEMY","FALSE","TRUE","FALSE"
"A4340","魔射缶：かまいたち","封入された魔法を起動する。/使うとなくなる。/１人に空気属性のダメージ。まれに切断状態にする。","7500",,,"140","TRUE","0","POW,M_ATK","4500","SD1039","1","ONE","FALSE","ENEMY","TRUE","TRUE","TRUE"
"A4341","魔射缶：風刃","封入された魔法を起動する。/使うとなくなる。/効果範囲全体に空気属性のダメージ。まれに切断状態にする。","7500",,,"180","TRUE","0","POW,M_ATK","4500","SD1038","1","IN_AREA","FALSE","ENEMY","FALSE","TRUE","FALSE"
"A4342","魔射缶：衝撃波","封入された魔法を起動する。/使うとなくなる。/効果範囲全体に空気属性のダメージ。高確率で気絶させる。","7500",,,"200","TRUE","0","POW,M_ATK","4500","SD1038","1","IN_AREA","FALSE","ENEMY","FALSE","TRUE","FALSE"
"A4343","魔射缶：内臓破裂","封入された魔法を起動する。/使うとなくなる。/１人に空気属性ダメージ、中確率で即死させる。","7500",,,"72","TRUE","0","POW,M_ATK","4500","SD1039","1","ONE","FALSE","ENEMY","TRUE","TRUE","TRUE"
"A4344","魔射缶：陣風","封入された魔法を起動する。/使うとなくなる。/効果範囲全体の攻撃、素早さ、防御、器用さを上昇する。","7500",,,"400","TRUE","0","POW,M_ATK","4500","SD1038","1","IN_AREA","FALSE","ENEMY","FALSE","TRUE","FALSE"
"A4345","魔射缶：木枯","封入された魔法を起動する。/使うとなくなる。/効果範囲全体の木化している対象を即死させる。/木化していない対象には何も起こらない。","7500",,,"400","TRUE","0","POW,M_ATK","4500","SD1038","1","IN_AREA","FALSE","ENEMY","FALSE","TRUE","FALSE"
"A4346","魔射缶：真空波","封入された魔法を起動する。/使うとなくなる。/効果範囲全員にダメージ","7500",,,"360","TRUE","0","POW,M_ATK","4500","SD1038","1","IN_AREA","FALSE","ENEMY","FALSE","TRUE","FALSE"
"A4347","魔射缶：真空抹殺","封入された魔法を起動する。/使うとなくなる。/効果範囲全体を低確率で即死させる。","7500",,,"300","TRUE","0","POW,M_ATK","4500","SD1038","1","IN_AREA","FALSE","ENEMY","FALSE","TRUE","FALSE"
"A4348","魔射缶：空圧圧縮","封入された魔法を起動する。/使うとなくなる。/１人に空気属性ダメージ。","7500",,,"180","TRUE","0","POW,M_ATK","4500","SD1039","1","ONE","FALSE","ENEMY","TRUE","TRUE","TRUE"
"A4349","魔射缶：雷","封入された魔法を起動する。/使うとなくなる。/１人に雷属性ダメージ。","7500",,,"180","TRUE","0","POW,M_ATK","4500","SD1037","1","ONE","FALSE","ENEMY","TRUE","TRUE","TRUE"
"A4350","魔射缶：火炎","封入された魔法を起動する。/使うとなくなる。/１人に炎属性ダメージ。","7500",,,"180","TRUE","0","POW,M_ATK","4500","SD1028","1","ONE","FALSE","ENEMY","TRUE","TRUE","TRUE"
"A4351","魔射缶：ファイアボルト","封入された魔法を起動する。/使うとなくなる。/１人に炎属性のダメージ。まれに炎上状態にする。凍結を回復する。","7500",,,"340","TRUE","0","POW,M_ATK","4500","SD1028","1","ONE","FALSE","ENEMY","TRUE","TRUE","TRUE"
"A4352","魔射缶：ファイアブレス","封入された魔法を起動する。/使うとなくなる。/効果範囲全体に炎属性のダメージ。/まれに炎上状態にする。凍結を回復する。","7500",,,"180","TRUE","0","POW,M_ATK","4500","SD1027","1","IN_AREA","FALSE","ENEMY","TRUE","TRUE","FALSE"
"A4353","魔射缶：篝火","封入された魔法を起動する。/使うとなくなる。/効果範囲全体を小回復する。また炎上状態を回復する。","7500",,,"72","TRUE","0","POW,M_ATK","4500","SD1014","1","ONE","FALSE","PARTY","TRUE","TRUE","FALSE"
"A4354","魔射缶：炎上治療","封入された魔法を起動する。/使うとなくなる。/１人の炎上を回復する。","7500",,,"72","TRUE","0","POW,M_ATK","4500","SD1014","1","ONE","FALSE","ENEMY","TRUE","TRUE","TRUE"
"A4355","魔射缶：灯台","封入された魔法を起動する。/使うとなくなる。/全体の物理攻撃回避率を下げる。","7500",,,"600","TRUE","0","POW,M_ATK","4500","SD1012","1","IN_AREA","FALSE","ENEMY","FALSE","TRUE","FALSE"
"A4356","魔射缶：炎熱作用","封入された魔法を起動する。/使うとなくなる。/効果範囲全体の湿潤を回復する。","7500",,,"160","TRUE","0","POW,M_ATK","4500","SD1014","1","IN_AREA","FALSE","PARTY","FALSE","TRUE","FALSE"
"A4357","魔射缶：熱光線","封入された魔法を起動する。/使うとなくなる。/１人に光属性ダメージ。凍結を回復する。","7500",,,"400","TRUE","0","POW,M_ATK","4500","SD1029","1","ONE","FALSE","ENEMY","TRUE","TRUE","TRUE"
"A4358","魔射缶：ウォーターフォール","封入された魔法を起動する。/使うとなくなる。/効果範囲全体に水属性ダメージ。高確率で湿潤状態にする。","7500",,,"550","TRUE","0","POW,M_ATK","4500","SD1023","1","IN_AREA","FALSE","ENEMY","FALSE","TRUE","FALSE"
"A4359","魔射缶：降雨","封入された魔法を起動する。/使うとなくなる。/全員の炎上を回復する。全員が湿潤状態になる。/木化している対象者は体力を回復する。","7500",,,"550","TRUE","0","POW,M_ATK","4500","SD1023","1","IN_AREA","FALSE","PARTY","TRUE","TRUE","TRUE"
"A4360","魔射缶：電撃散布","封入された魔法を起動する。/使うとなくなる。/効果範囲内の敵に雷属性ダメージ。","7500",,,"220","TRUE","0","POW,M_ATK","4500","SD1037","1","IN_AREA","FALSE","ENEMY","FALSE","TRUE","FALSE"
"A4361","魔射缶：霊峰の指","封入された魔法を起動する。/使うとなくなる。/１人に雷属性の大ダメージ。/50%の確率でこのターンの最後に再度発動する。/その際の魔力などは術者が再度支払う。この効果は連続することがある。","7500",,,"72","TRUE","0","POW,M_ATK","4500","SD1037","1","ONE","FALSE","ENEMY","TRUE","TRUE","TRUE"
"A4362","魔射缶：天地雷鳴","封入された魔法を起動する。/使うとなくなる。/効果範囲全体に雷属性の大ダメージ。","7500",,,"150","TRUE","0","POW,M_ATK","4500","SD1037","1","IN_AREA","FALSE","ENEMY","FALSE","TRUE","FALSE"
"A4363","魔射缶：雷鳴八卦","封入された魔法を起動する。/使うとなくなる。/１人に雷属性の大ダメージ。まれに麻痺状態にする。","7500",,,"72","TRUE","0","POW,M_ATK","4500","SD1037","1","ONE","FALSE","ENEMY","TRUE","TRUE","TRUE"
"A4364","魔射缶：メモリチェック","封入された魔法を起動する。/使うとなくなる。/上位者に介入し、その結果を表示する。","7500",,,"0","TRUE","0","POW,M_ATK","4500","SD1032","1","IN_AREA","FALSE","PARTY","FALSE","TRUE","FALSE"
"A4365","魔射缶：クラッシュ","封入された魔法を起動する。/使うとなくなる。/上位者に介入し、世界を終わらせる。","7500",,,"0","TRUE","0","POW,M_ATK","4500","SD1032","1","IN_AREA","FALSE","PARTY","FALSE","TRUE","FALSE"
"A4366","魔射缶：ゲームオーバー","封入された魔法を起動する。/使うとなくなる。/上位者に介入し、世界を終わらせる。","7500",,,"0","TRUE","0","POW,M_ATK","4500","SD1032","1","IN_AREA","FALSE","PARTY","FALSE","TRUE","FALSE"
"A4367","魔射缶：戦闘からの離脱","封入された魔法を起動する。/使うとなくなる。/上位者に介入し、戦闘を終わらせる。","7500",,,"0","TRUE","0","POW,M_ATK","4500","SD1032","1","IN_AREA","FALSE","PARTY","FALSE","TRUE","FALSE"
"A4368","魔射缶：エンカウントカウンタリセット","封入された魔法を起動する。/使うとなくなる。/上位者に介入し、運命を操作する。","7500",,,"0","TRUE","0","POW,M_ATK","4500","SD1032","1","IN_AREA","FALSE","PARTY","FALSE","TRUE","FALSE"
"A4369","魔射缶：エンカウントカウンタ+128","封入された魔法を起動する。/使うとなくなる。/上位者に介入し、運命を操作する。","7500",,,"0","TRUE","0","POW,M_ATK","4500","SD1032","1","IN_AREA","FALSE","PARTY","FALSE","TRUE","FALSE"
"A4370","魔射缶：デバッグモードON","封入された魔法を起動する。/使うとなくなる。/上位者に介入し、その結果を表示する。","7500",,,"0","TRUE","0","POW,M_ATK","4500","SD1032","1","IN_AREA","FALSE","PARTY","FALSE","TRUE","FALSE"
"A4371","魔射缶：デバッグモードOFF","封入された魔法を起動する。/使うとなくなる。/上位者に介入し、その結果を表示する。","7500",,,"0","TRUE","0","POW,M_ATK","4500","SD1032","1","IN_AREA","FALSE","PARTY","FALSE","TRUE","FALSE"
"A4372","魔射缶：condition同期ずれチェック","封入された魔法を起動する。/使うとなくなる。/上位者に介入し、その結果を表示する。","7500",,,"0","TRUE","0","POW,M_ATK","4500","SD1032","1","IN_AREA","FALSE","PARTY","FALSE","TRUE","FALSE"
"A4373","魔射缶：全員完全回復","封入された魔法を起動する。/使うとなくなる。/上位者に介入し、１人のステータスを変更する。","7500",,,"9999","TRUE","0","POW,M_ATK","4500","SD1032","1","IN_AREA","TRUE","PARTY","FALSE","TRUE","FALSE"
"A4374","魔射缶：敵の召喚","封入された魔法を起動する。/使うとなくなる。/上位者に介入し、その結果を表示する。","7500",,,"0","TRUE","0","POW,M_ATK","4500","SD1040","1","ONE","TRUE","PARTY","FALSE","TRUE","FALSE"
"A4375","魔射缶：サウンド破棄","封入された魔法を起動する。/使うとなくなる。/１人を小回復する。凍結を回復する。","7500",,,"0","TRUE","0","POW,M_ATK","4500","SD1032","1","IN_AREA","FALSE","PARTY","FALSE","TRUE","FALSE"
"A4376","魔射缶：ホットティー召喚","封入された魔法を起動する。/使うとなくなる。/１人を木化させる。","7500",,,"72","TRUE","0","POW,M_ATK","4500","SD1014","1","ONE","FALSE","PARTY","TRUE","TRUE","TRUE"
"A4377","魔射缶：木化","封入された魔法を起動する。/使うとなくなる。/効果範囲全体に地属性ダメージ。","7500",,,"72","TRUE","0","POW,M_ATK","4500","SD1038","1","ONE","FALSE","ENEMY","TRUE","TRUE","TRUE"
"A4378","魔射缶：地震","封入された魔法を起動する。/使うとなくなる。/効果範囲全体に地属性ダメージ。","7500",,,"800","TRUE","0","POW,M_ATK","4500","SD1015","1","IN_AREA","FALSE","ENEMY","TRUE","TRUE","FALSE"
"A4379","魔射缶：大地の怒り","封入された魔法を起動する。/使うとなくなる。/低確率で効果範囲全体を即死させる。","7500",,,"800","TRUE","0","POW,M_ATK","4500","SD1015","1","IN_AREA","FALSE","ENEMY","TRUE","TRUE","FALSE"
"A4380","魔射缶：地割れ","封入された魔法を起動する。/使うとなくなる。/１人に地属性ダメージ。","7500",,,"800","TRUE","0","POW,M_ATK","4500","SD1015","1","IN_AREA","FALSE","ENEMY","TRUE","TRUE","FALSE"
"A4381","魔射缶：岸壁直撃","封入された魔法を起動する。/使うとなくなる。/１人に地属性ダメージ。まれに気絶させる","7500",,,"160","TRUE","0","POW,M_ATK","4500","SD1015","1","ONE","FALSE","ENEMY","TRUE","TRUE","TRUE"
"A4382","魔射缶：岩塊","封入された魔法を起動する。/使うとなくなる。/１人に地属性ダメージ。まれに発狂させる","7500",,,"160","TRUE","0","POW,M_ATK","4500","SD1015","1","ONE","FALSE","ENEMY","TRUE","TRUE","TRUE"
"A4383","魔射缶：隕石","封入された魔法を起動する。/使うとなくなる。/１人に地属性ダメージ。まれに気絶させる","7500",,,"160","TRUE","0","POW,M_ATK","4500","SD1015","1","ONE","FALSE","ENEMY","TRUE","TRUE","TRUE"
"A4384","魔射缶：巨岩","封入された魔法を起動する。/使うとなくなる。/効果範囲内の敵に冷気属性ダメージ。","7500",,,"160","TRUE","0","POW,M_ATK","4500","SD1015","1","ONE","FALSE","ENEMY","TRUE","TRUE","TRUE"
"A4385","魔射缶：冷風","封入された魔法を起動する。/使うとなくなる。/効果範囲内の炎上を一定確率で治療する。","7500",,,"260","TRUE","0","POW,M_ATK","4500","SD1024","1","IN_AREA","FALSE","ENEMY","TRUE","TRUE","FALSE"
"A4386","魔射缶：涼風","封入された魔法を起動する。/使うとなくなる。/効果範囲内の敵に冷気属性ダメージ。","7500",,,"260","TRUE","0","POW,M_ATK","4500","SD1024","1","IN_AREA","FALSE","ENEMY","TRUE","TRUE","FALSE"
